{
  "$schema": "https://json-schema.org/draft/2020-12/schema",
  "type": "object",
  "additionalProperties": false,
  "required": [
    "title",
    "problem",
    "why_this_is_simpler",
    "why_thesis_exactness_should_be_preserved",
    "likely_files",
    "expected_benefits",
    "risks",
    "required_validation"
  ],
  "properties": {
    "title": {"type": "string"},
    "problem": {"type": "string"},
    "why_this_is_simpler": {"type": "string"},
    "why_thesis_exactness_should_be_preserved": {"type": "string"},
    "likely_files": {"type": "array", "items": {"type": "string"}},
    "expected_benefits": {"type": "array", "items": {"type": "string"}},
    "risks": {"type": "array", "items": {"type": "string"}},
    "required_validation": {"type": "array", "items": {"type": "string"}}
  }
}
